### ISSUE TITLE
Proxy does not work with pppoe

### ISSUE THREAD

**Issue by Monviech** [Monviech/ndp-proxy-go#3]
https://www.reddit.com/r/opnsense/comments/1p758t0/comment/nqwb48m/

PPPoE devices do not work.

Since the proxy requires an LLA and MAC to send the initial RS and NAs, it will currently fail to work on point to point links.

Maybe this could be fixed, but this is entirely theoretical:

https://github.com/Monviech/ndp-proxy-go/blob/5cbc094a37ff739e6960dd9400b2ccf8bdbe675a/packet.go#L338-L341

I assume it fails since a PPP link does not have a MAC, so mac is nil.

```
pppoe0: flags=10089d1<UP,POINTOPOINT,RUNNING,NOARP,PROMISC,SIMPLEX,MULTICAST,LOWER_UP> metric 0 mtu 1492
	description: aaaa (opt3)
	options=0
	inet6 fe80::215:5dff:fe00:ad23%pppoe0 prefixlen 64 scopeid 0xa
	nd6 options=23<PERFORMNUD,ACCEPT_RTADV,AUTO_LINKLOCAL>
```

I think it cannot work fundamentally because it is not an ethernet device.

The whole design of the proxy revolves around being on multi access ethernet and not on a point to point link.

**Comment by fichtner** [comment]
https://github.com/opnsense/dhcp6c/blob/dcd3815ad138e81f83d4d2187cdce7260d62cb25/config.c#L1384-L1398

just generate one

**Comment by Monviech** [comment]
I made this branch here:

https://github.com/Monviech/ndp-proxy-go/tree/pppoe-experimental

It detects PPPoE automatically, is experimental though since I cannot test it. I have only confirmed that I could see the initial RS on a PPPoE interface which had a link local address.

@leo15dev If you wanne try it out, build instructions are in the Readme. If you need more help building it just tell me.

**Comment by fichtner** [comment]
“install” doesn’t work when already installed. Use “reinstall”

**Comment by Monviech** [comment]
Can you tell me if ```netstat -rn6``` shows installed routes for your clients? There should be /128 routes installed.

If that is the case, the proxy has done its thing and the traffic should flow correctly.

The log message can be disregarded, it just says that NS/NA are not forwarded upstream (which they shouldnt for point to point).

----

Essentiall the proxy is only on the "Control Plane", meaning it has nothing to do with the "Data Plane" (aka the actual IPv6 packets being routed through the firewall).

Could you troubleshoot a bit, check if your firewall rules are correct, if you have NAT66 or something still enabled? Please double check everything, because right now it's unsure if its the proxy.

---

Best to test with ```tcpdump -i pppoe0 icmp6``` and see if when you send an IPv6 ping from a client, it goes out of the PPPoE interface.

Thanks for testing the latest version by the way.

**Comment by leo15dev** [comment]
#netstat -rn6

Active Internet connections (w/o servers)
Proto Recv-Q Send-Q Local Address           Foreign Address         State

#tcpdump -i pppoe1 (wan1)
when I ping to 2606:4700:4700::1111), the is no data show on the screen

So maybe the issued is related to my ISP?

Thank you!

**Comment by Monviech** [comment]
Could you deactivate IPv6 one of the PPPoE interfaces for testing?

Things I notice:
- I do not see any /128 host routes installed
- I do not see return traffic from the ISP, but its going out into pppoe0 (didnt you configure the proxy on pppoe1?)
- default fe80::9ee0:41ff:febc:2098%pppoe1 UG pppoe1 <- If the default gateway is pppoe1 why is it going out of pppoe0?

I assume the following:
- Your clients have a GUA in the wrong prefix
- The proxy thus refuses to learn their address, and does not install a route
- The traffic gets routed to the wrong PPPoE interface for some reason

Unsure if its the proxy or if your setup is a bit messy. Best deactivate one uplink link and retest (or deactivate IPv6 on one uplink)

**Comment by leo15dev** [comment]
Sure, here is the test results

1.
ping -6 2001:4860:4860::8888
PING 2001:4860:4860::8888 (2001:4860:4860::8888) 56 data bytes
no response

 tcpdump -i vlan03 icmp6
tcpdump: verbose output suppressed, use -v[v]... for full protocol decode
listening on vlan03, link-type EN10MB (Ethernet), snapshot length 262144 bytes
23:03:45.573459 IP6 2001-b011-AVCD-EDFG-6a84-7eff-fea1-e828.dynamic-ip6.ISP.net > dns.google: ICMP6, echo request, id 28954, seq 15, length 64
23:03:46.597211 IP6 2001-b011-AVCD-EDFG-6a84-7eff-fea1-e828.dynamic-ip6.ISP.net > dns.google: ICMP6, echo request, id 28954, seq 16, length 64
23:03:47.621443 IP6 2001-b011-AVCD-EDFG-6a84-7eff-fea1-e828.dynamic-ip6.ISP.net > dns.google: ICMP6, echo request, id 28954, seq 17, length 64
23:03:48.645352 IP6 2001-b011-AVCD-EDFG-6a84-7eff-fea1-e828.dynamic-ip6.ISP.net > dns.google: ICMP6, echo request, id 28954, seq 18, length 64
23:03:49.669457 IP6 2001-b011-AVCD-EDFG-6a84-7eff-fea1-e828.dynamic-ip6.ISP.net > dns.google: ICMP6, echo request, id 28954, seq 19, length 64
23:03:50.693409 IP6 2001-b011-AVCD-EDFG-6a84-7eff-fea1-e828.dynamic-ip6.ISP.net > dns.google: ICMP6, echo request, id 28954, seq 20, length 64
23:03:51.717237 IP6 2001-b011-AVCD-EDFG-6a84-7eff-fea1-e828.dynamic-ip6.ISP.net > dns.google: ICMP6, echo request, id 28954, seq 21, length 64
23:03:52.742145 IP6 2001-b011-AVCD-EDFG-6a84-7eff-fea1-e828.dynamic-ip6.ISP.net > dns.google: ICMP6, echo request, id 28954, seq 22, length 64
23:03:53.765373 IP6 2001-b011-AVCD-EDFG-6a84-7eff-fea1-e828.dynamic-ip6.ISP.net > dns.google: ICMP6, echo request, id 28954, seq 23, length 64
23:03:54.789477 IP6 2001-b011-AVCD-EDFG-6a84-7eff-fea1-e828.dynamic-ip6.ISP.net > dns.google: ICMP6, echo request, id 28954, seq 24, length 64
23:03:55.813382 IP6 2001-b011-AVCD-EDFG-6a84-7eff-fea1-e828.dynamic-ip6.ISP.net > dns.google: ICMP6, echo request, id 28954, seq 25, length 64
23:03:56.837426 IP6 2001-b011-AVCD-EDFG-6a84-7eff-fea1-e828.dynamic-ip6.ISP.net > dns.google: ICMP6, echo request, id 28954, seq 26, length 64
23:03:57.861398 IP6 2001-b011-AVCD-EDFG-6a84-7eff-fea1-e828.dynamic-ip6.ISP.net > dns.google: ICMP6, echo request, id 28954, seq 27, length 64
23:03:58.885471 IP6 2001-b011-AVCD-EDFG-6a84-7eff-fea1-e828.dynamic-ip6.ISP.net > dns.google: ICMP6, echo request, id 28954, seq 28, length 64
23:03:59.909503 IP6 2001-b011-AVCD-EDFG-6a84-7eff-fea1-e828.dynamic-ip6.ISP.net > dns.google: ICMP6, echo request, id 28954, seq 29, length 64
23:04:00.933484 IP6 2001-b011-AVCD-EDFG-6a84-7eff-fea1-e828.dynamic-ip6.ISP.net > dns.google: ICMP6, echo request, id 28954, seq 30, length 64
23:04:01.957152 IP6 2001-b011-AVCD-EDFG-6a84-7eff-fea1-e828.dynamic-ip6.ISP.net > dns.google: ICMP6, echo request, id 28954, seq 31, length 64
23:04:02.981489 IP6 2001-b011-AVCD-EDFG-6a84-7eff-fea1-e828.dynamic-ip6.ISP.net > dns.google: ICMP6, echo request, id 28954, seq 32, length 64
23:04:04.005420 IP6 2001-b011-AVCD-EDFG-6a84-7eff-fea1-e828.dynamic-ip6.ISP.net > dns.google: ICMP6, echo request, id 28954, seq 33, length 64
23:04:05.029457 IP6 2001-b011-AVCD-EDFG-6a84-7eff-fea1-e828.dynamic-ip6.ISP.net > dns.google: ICMP6, echo request, id 28954, seq 34, length 64
23:04:06.053428 IP6 2001-b011-AVCD-EDFG-6a84-7eff-fea1-e828.dynamic-ip6.ISP.net > dns.google: ICMP6, echo request, id 28954, seq 35, length 64

2
netstat -rn6
Routing tables

Internet6:
Destination                       Gateway                       Flags         Netif Expire
default                           fe80::9ee0:41ff:febc:2098%pppoe0 UG        pppoe0
::1                               link#3                        UHS             lo0
2001:b011:AVCD:EDFG::/64          link#10                       U            pppoe0
2001:b011:AVCD:EDFG:be24:11ff:feb0:bfc4 link#3                  UHS             lo0
fd57:597e:757e::/64               link#2                        U            vtnet1
fd57:597e:757e::1                 link#3                        UHS             lo0
fd57:597e:757e:abcd::/64          link#7                        U            vlan03
fd57:597e:757e:abcd::1            link#3                        UHS             lo0
fd57:597e:757e:abce::/64          link#8                        U            vlan04
fd57:597e:757e:abce::1            link#3                        UHS             lo0
fe80::%vtnet0/64                  link#1                        U            vtnet0
fe80::be24:11ff:feb0:bfc4%lo0     link#3                        UHS             lo0
fe80::%vtnet1/64                  link#2                        U            vtnet1
fe80::be24:11ff:fe69:7ce1%lo0     link#3                        UHS             lo0
fe80::%lo0/64                     link#3                        U               lo0
fe80::1%lo0                       link#3                        UHS             lo0
fe80::%vlan03/64                  link#7                        U            vlan03
fe80::be24:11ff:fe69:7ce1%lo0     link#3                        UHS             lo0
fe80::%vlan04/64                  link#8                        U            vlan04
fe80::be24:11ff:fe69:7ce1%lo0     link#3                        UHS             lo0
fe80::%pppoe0/64                  link#10                       U            pppoe0
fe80::be24:11ff:fe69:7ce1%lo0     link#3                        UHS             lo0
fe80::be24:11ff:feb0:bfc4%lo0     link#3                        UHS             lo0

3.
ping -6 2001:4860:4860::8888
PING 2001:4860:4860::8888 (2001:4860:4860::8888) 56 data bytes
no response

tcpdump -i pppoe0 icmp6
tcpdump: verbose output suppressed, use -v[v]... for full protocol decode
listening on pppoe0, link-type NULL (BSD loopback), snapshot length 262144 bytes

23:11:51.694322 IP6 2001-b011-AVCD-EDFG-be24-11ff-feb0-bfc4.dynamic-ip6.ISP.net > dns.google: ICMP6, destination unreachable, unreachable port, 2001-b011-AVCD-EDFG-be24-11ff-feb0-bfc4.dynamic-ip6.ISP.net udp port 7796, length 130
23:11:51.696463 IP6 2001-b011-AVCD-EDFG-be24-11ff-feb0-bfc4.dynamic-ip6.ISP.net > dns.google: ICMP6, destination unreachable, unreachable port, 2001-b011-AVCD-EDFG-be24-11ff-feb0-bfc4.dynamic-ip6.ISP.net udp port 55775, length 142
23:13:53.154825 IP6 2001-b011-AVCD-EDFG-be24-11ff-feb0-bfc4.dynamic-ip6.ISP.net > dns.google: ICMP6, destination unreachable, unreachable port, 2001-b011-AVCD-EDFG-be24-11ff-feb0-bfc4.dynamic-ip6.ISP.net udp port 59635, length 130
23:13:53.157212 IP6 2001-b011-AVCD-EDFG-be24-11ff-feb0-bfc4.dynamic-ip6.ISP.net > dns.google: ICMP6, destination unreachable, unreachable port, 2001-b011-AVCD-EDFG-be24-11ff-feb0-bfc4.dynamic-ip6.ISP.net udp port 34068, length 130
23:13:53.157258 IP6 2001-b011-AVCD-EDFG-be24-11ff-feb0-bfc4.dynamic-ip6.ISP.net > dns.google: ICMP6, destination unreachable, unreachable port, 2001-b011-AVCD-EDFG-be24-11ff-feb0-bfc4.dynamic-ip6.ISP.net udp port 59258, length 142
23:13:53.158776 IP6 2001-b011-AVCD-EDFG-be24-11ff-feb0-bfc4.dynamic-ip6.ISP.net > dns.google: ICMP6, destination unreachable, unreachable port, 2001-b011-AVCD-EDFG-be24-11ff-feb0-bfc4.dynamic-ip6.ISP.net udp port 33892, length 142
23:13:53.175213 IP6 2001-b011-AVCD-EDFG-be24-11ff-feb0-bfc4.dynamic-ip6.ISP.net > dns.google: ICMP6, destination unreachable, unreachable port, 2001-b011-AVCD-EDFG-be24-11ff-feb0-bfc4.dynamic-ip6.ISP.net udp port 4345, length 113
23:13:53.175686 IP6 2001-b011-AVCD-EDFG-be24-11ff-feb0-bfc4.dynamic-ip6.ISP.net > dns.google: ICMP6, destination unreachable, unreachable port, 2001-b011-AVCD-EDFG-be24-11ff-feb0-bfc4.dynamic-ip6.ISP.net udp port 44441, length 113
23:13:53.961595 IP6 2001-b000-00e0-0004-3052-4111-0004-000b.ISP-ip6.ISP.net > 2001-b011-AVCD-EDFG-be24-11ff-feb0-bfc4.dynamic-ip6.ISP.net: ICMP6, destination unreachable, unreachable route d57:597e:757e:abcd::3, length 1240

**Comment by Monviech** [comment]
Who is: d57:597e:757e:abcd::3 ?

Its on this network fd57:597e:757e:abcd::/64 link#7 U vlan03

Is that where you ping from?

I suggest you also remove:

- All ULA configuration (Unique Local Addresses) -> On OPNsense and on your test client (if you configured it statically there)
- Stop all competing RA servers (dnsmasq or "Services - Router Advertisements"
- Only have SLAAC on the PPPoE interface
- Only have "Link Local" on the internal interfaces. No VIPs (virtual IPs) with additional ULAs.

Once we reduce all of that out, and there's still no routes installed, I need the full debug log of the ndp proxy after a restart, and after the client initiated the ping.

We're getting closer but this is still fuzzy...

**Comment by Monviech** [comment]
I took the time and reconfigured my own pppoe connection to run on the OPNsense itself. I can verify the proxy is indeed working with this branch. It seems to be generic, since it works with my provider and SLAAC as well.

Note: I did not omit any IP addresses since they are IPv6 privacy extensions.

Macbook:
```
@MBP ~ % ping6 2001:4860:4860::8844
PING6(56=40+8+8 bytes) 2003:a:177f:8463:b40e:4343:1cc8:df32 --> 2001:4860:4860::8844
16 bytes from 2001:4860:4860::8844, icmp_seq=0 hlim=118 time=12.487 ms
16 bytes from 2001:4860:4860::8844, icmp_seq=1 hlim=118 time=13.181 ms
16 bytes from 2001:4860:4860::8844, icmp_seq=2 hlim=118 time=12.913 ms
16 bytes from 2001:4860:4860::8844, icmp_seq=3 hlim=118 time=13.340 ms
16 bytes from 2001:4860:4860::8844, icmp_seq=4 hlim=118 time=13.123 ms
```

```
OPNsense vlan0.2 (Macbook connects here:
root@opn03:~ # tcpdump -ni vlan0.2 icmp6
19:39:33.126707 IP6 2003:a:177f:8463:b40e:4343:1cc8:df32 > 2001:4860:4860::8844: ICMP6, echo request, id 34237, seq 0, length 16
19:39:33.139439 IP6 2001:4860:4860::8844 > 2003:a:177f:8463:b40e:4343:1cc8:df32: ICMP6, echo reply, id 34237, seq 0, length 16
```

OPNsense routing table:
```
root@opn03:~ # netstat -rn6
Routing tables

Internet6:
Destination                       Gateway                       Flags         Netif Expire
default                           fe80::200:ff:fe00:0%pppoe0    UG           pppoe0
::1                               link#6                        UHS             lo0
2003:a:177f:8463::/64             link#32                       U            pppoe0
2003:a:177f:8463:b40e:4343:1cc8:df32 link#23                    UHS         vlan0.2
fe80::%lo0/64                     link#6                        U               lo0
fe80::1%lo0                       link#6                        UHS             lo0
fe80::%vlan0.1/64                 link#11                       U           vlan0.1
fe80::f690:eaff:fe01:3dc9%lo0     link#6                        UHS             lo0
fe80::%vlan0.2/64                 link#23                       U           vlan0.2
fe80::f690:eaff:fe01:3dc9%lo0     link#6                        UHS             lo0
fe80::%pppoe0/64                  link#32                       U            pppoe0
fe80::f690:eaff:fe01:3dc6%lo0     link#6                        UHS             lo0
```

OPNsense pppoe interface (WAN):
```
root@opn03:~ # tcpdump -ni pppoe0 icmp6
19:42:56.203432 IP6 2003:a:177f:8463:b40e:4343:1cc8:df32 > 2001:4860:4860::8844: ICMP6, echo request, id 34254, seq 0, length 16
19:42:56.215920 IP6 2001:4860:4860::8844 > 2003:a:177f:8463:b40e:4343:1cc8:df32: ICMP6, echo reply, id 34254, seq 0, length 16
```

NDP Proxy Logs:
(The skips are okay, its debug level after all so there is quite some noise in the logs)
```
2025-11-29T19:35:34Noticendpproxy skipping NA/NS upstream forward on point-to-point interface pppoe0 (type 136)
2025-11-29T19:35:34Noticendpproxy forwarding NA from vlan0.2 (target 2003:a:177f:8463:b40e:4343:1cc8:df32) to upstream
2025-11-29T19:35:34Noticendpproxy learned address 2003:a:177f:8463:b40e:4343:1cc8:df32 from NA on vlan0.2 (port 1)
2025-11-29T19:35:34Noticendpproxy cache entry TTL refreshed 2003:a:177f:8463:b40e:4343:1cc8:df32 on vlan0.2 (port 1)
2025-11-29T19:35:34Noticendpproxy route installed: 2003:a:177f:8463:b40e:4343:1cc8:df32 via vlan0.2
2025-11-29T19:35:34Noticendpproxy learned 2003:a:177f:8463:b40e:4343:1cc8:df32 on vlan0.2 (port 1)
2025-11-29T19:35:34Noticendpproxy RA prefix learned: 2003:a:177f:8463::/64 (valid 4h0m0s)
2025-11-29T19:35:34Noticendpproxy router LLA learned: fe80::200:ff:fe00:0
2025-11-29T19:35:34Noticendpproxy sending Router Solicitation on pppoe0
2025-11-29T19:35:34Noticendpproxy upstream=pppoe0 downstream=vlan0.1,vlan0.2 no-ra=false no-routes=false no-dad=false no-rewrite-lla=false cache-ttl=10m0s cache-max=4096 route-qps=50 route-burst=50 pcap-timeout=50ms
2025-11-29T19:35:34Noticendpproxy detected ethernet on vlan0.2 (DLT=1)
2025-11-29T19:35:34Noticendpproxy detected ethernet on vlan0.1 (DLT=1)
2025-11-29T19:35:34Noticendpproxy detected point-to-point on pppoe0 (DLT=0)
```

So I am very confident it will work for you as well, once you have corrected your infra. :)

**Comment by leo15dev** [comment]
The test machine is running **Ubuntu 24.04.3 LTS (GNU/Linux 6.8.0-88-generic x86_64)**. It is a bare-metal installation (not virtualized).

Do you mean something like this? I originally copied this configuration from the default LAN interface.
<img width="3163" height="2498" alt="Image" src="https://github.com/user-attachments/assets/73341553-5c4e-401c-9828-46739a2cec30" />

Other than using the **lexperimental version of NDP Proxy Go (Commit 6554f63)**, the test conditions are identical to my previous post (I haven't changed any settings since the last test).

I rebooted OPNsense first, followed by the test machine, to ensure the client obtained a fresh ISP Prefix. The outcome is similar to my previous attempt.

Here are the test results:

1.
ping -6 2001:4860:4860::8888
no response


tcpdump -i vlan03 icmp6
```
tcpdump: verbose output suppressed, use -v[v]... for full protocol decode
listening on vlan03, link-type EN10MB (Ethernet), snapshot length 262144 bytes
20:09:49.714153 IP6 fe80::be24:11ff:fe69:7ce1 > fe80::6a84:7eff:fea1:e828: ICMP6, neighbor solicitation, who has fe80::6a84:7eff:fea1:e828, length 32
20:09:49.714552 IP6 fe80::6a84:7eff:fea1:e828 > fe80::be24:11ff:fe69:7ce1: ICMP6, neighbor advertisement, tgt is fe80::6a84:7eff:fea1:e828, length 24
20:10:03.778234 IP6 2001-b011-abcd-dfgh-6a84-7eff-fea1-e828.dynamic-ip6.ISP.net > dns.google: ICMP6, echo request, id 21755, seq 1, length 64
20:10:04.828895 IP6 2001-b011-abcd-dfgh-6a84-7eff-fea1-e828.dynamic-ip6.ISP.net > dns.google: ICMP6, echo request, id 21755, seq 2, length 64
20:10:05.851216 IP6 2001-b011-abcd-dfgh-6a84-7eff-fea1-e828.dynamic-ip6.ISP.net > dns.google: ICMP6, echo request, id 21755, seq 3, length 64
20:10:06.875256 IP6 2001-b011-abcd-dfgh-6a84-7eff-fea1-e828.dynamic-ip6.ISP.net > dns.google: ICMP6, echo request, id 21755, seq 4, length 64
20:10:07.899078 IP6 2001-b011-abcd-dfgh-6a84-7eff-fea1-e828.dynamic-ip6.ISP.net > dns.google: ICMP6, echo request, id 21755, seq 5, length 64
20:10:08.923216 IP6 2001-b011-abcd-dfgh-6a84-7eff-fea1-e828.dynamic-ip6.ISP.net > dns.google: ICMP6, echo request, id 21755, seq 6, length 64
20:10:09.948085 IP6 2001-b011-abcd-dfgh-6a84-7eff-fea1-e828.dynamic-ip6.ISP.net > dns.google: ICMP6, echo request, id 21755, seq 7, length 64
20:10:10.971873 IP6 2001-b011-abcd-dfgh-6a84-7eff-fea1-e828.dynamic-ip6.ISP.net > dns.google: ICMP6, echo request, id 21755, seq 8, length 64
20:10:11.995164 IP6 2001-b011-abcd-dfgh-6a84-7eff-fea1-e828.dynamic-ip6.ISP.net > dns.google: ICMP6, echo request, id 21755, seq 9, length 64
20:10:13.018807 IP6 fe80::6a84:7eff:fea1:e828 > fe80::be24:11ff:fe69:7ce1: ICMP6, neighbor solicitation, who has fe80::be24:11ff:fe69:7ce1, length 32
20:10:13.018860 IP6 fe80::be24:11ff:fe69:7ce1 > fe80::6a84:7eff:fea1:e828: ICMP6, neighbor advertisement, tgt is fe80::be24:11ff:fe69:7ce1, length 24
20:10:13.018962 IP6 2001-b011-abcd-dfgh-6a84-7eff-fea1-e828.dynamic-ip6.ISP.net > dns.google: ICMP6, echo request, id 21755, seq 10, length 64
20:10:14.042974 IP6 2001-b011-abcd-dfgh-6a84-7eff-fea1-e828.dynamic-ip6.ISP.net > dns.google: ICMP6, echo request, id 21755, seq 11, length 64
20:10:15.067155 IP6 2001-b011-abcd-dfgh-6a84-7eff-fea1-e828.dynamic-ip6.ISP.net > dns.google: ICMP6, echo request, id 21755, seq 12, length 64
20:10:16.091136 IP6 2001-b011-abcd-dfgh-6a84-7eff-fea1-e828.dynamic-ip6.ISP.net > dns.google: ICMP6, echo request, id 21755, seq 13, length 64
20:10:17.115119 IP6 2001-b011-abcd-dfgh-6a84-7eff-fea1-e828.dynamic-ip6.ISP.net > dns.google: ICMP6, echo request, id 21755, seq 14, length 64

```

2.

netstat -rn6
```
Routing tables

Internet6:
Destination                       Gateway                       Flags         Netif Expire
default                           fe80::9ee0:41ff:febc:2098%pppoe0 UG        pppoe0
::1                               link#3                        UHS             lo0
2001:b011:abcd:dfgh::/64          link#10                       U            pppoe0
2001:b011:abcd:dfgh:be24:11ff:fe69:7ce1 link#3                  UHS             lo0
fd57:597e:757e::/64               link#2                        U            vtnet1
fd57:597e:757e::1                 link#3                        UHS             lo0
fd57:597e:757e:abce::/64          link#8                        U            vlan04
fd57:597e:757e:abce::1            link#3                        UHS             lo0
fe80::%vtnet1/64                  link#2                        U            vtnet1
fe80::be24:11ff:fe69:7ce1%lo0     link#3                        UHS             lo0
fe80::%lo0/64                     link#3                        U               lo0
fe80::1%lo0                       link#3                        UHS             lo0
fe80::%vlan03/64                  link#7                        U            vlan03
fe80::be24:11ff:fe69:7ce1%lo0     link#3                        UHS             lo0
fe80::%vlan04/64                  link#8                        U            vlan04
fe80::be24:11ff:fe69:7ce1%lo0     link#3                        UHS             lo0
fe80::%pppoe0/64                  link#10                       U            pppoe0
fe80::be24:11ff:fe69:7ce1%lo0     link#3                        UHS             lo0
```

3.
ping -6 2001:4860:4860::8888
no response


tcpdump -i pppoe0 icmp6
```
tcpdump: verbose output suppressed, use -v[v]... for full protocol decode
listening on pppoe0, link-type NULL (BSD loopback), snapshot length 262144 bytes
20:16:41.868528 IP6 fe80::9ee0:41ff:febc:2098 > ff02::1: ICMP6, router advertisement, length 96
20:17:22.710841 IP6 2001-b011-abcd-dfgh-be24-11ff-fe69-7ce1.dynamic-ip6.ISP.net > dns.google: ICMP6, destination unreachable, unreachable port, 2001-b011-abcd-dfgh-be24-11ff-fe69-7ce1.dynamic-ip6.ISP.net udp port 37368, length 113
20:17:22.711460 IP6 2001-b011-abcd-dfgh-be24-11ff-fe69-7ce1.dynamic-ip6.ISP.net > dns.google: ICMP6, destination unreachable, unreachable port, 2001-b011-abcd-dfgh-be24-11ff-fe69-7ce1.dynamic-ip6.ISP.net udp port 9556, length 113
20:17:22.713815 IP6 2001-b011-abcd-dfgh-be24-11ff-fe69-7ce1.dynamic-ip6.ISP.net > dns.google: ICMP6, destination unreachable, unreachable port, 2001-b011-abcd-dfgh-be24-11ff-fe69-7ce1.dynamic-ip6.ISP.net udp port 25587, length 130
20:17:22.713827 IP6 2001-b011-abcd-dfgh-be24-11ff-fe69-7ce1.dynamic-ip6.ISP.net > dns.google: ICMP6, destination unreachable, unreachable port, 2001-b011-abcd-dfgh-be24-11ff-fe69-7ce1.dynamic-ip6.ISP.net udp port 31876, length 130
20:17:22.717425 IP6 2001-b011-abcd-dfgh-be24-11ff-fe69-7ce1.dynamic-ip6.ISP.net > dns.google: ICMP6, destination unreachable, unreachable port, 2001-b011-abcd-dfgh-be24-11ff-fe69-7ce1.dynamic-ip6.ISP.net udp port 22281, length 142
20:17:22.717427 IP6 2001-b011-abcd-dfgh-be24-11ff-fe69-7ce1.dynamic-ip6.ISP.net > dns.google: ICMP6, destination unreachable, unreachable port, 2001-b011-abcd-dfgh-be24-11ff-fe69-7ce1.dynamic-ip6.ISP.net udp port 35645, length 142
20:18:48.620279 IP6 2001-b011-abcd-dfgh-be24-11ff-fe69-7ce1.dynamic-ip6.ISP.net > dns.google: ICMP6, destination unreachable, unreachable port, 2001-b011-abcd-dfgh-be24-11ff-fe69-7ce1.dynamic-ip6.ISP.net udp port 25976, length 101
20:18:48.620328 IP6 2001-b011-abcd-dfgh-be24-11ff-fe69-7ce1.dynamic-ip6.ISP.net > dns.google: ICMP6, destination unreachable, unreachable port, 2001-b011-abcd-dfgh-be24-11ff-fe69-7ce1.dynamic-ip6.ISP.net udp port 65068, length 101
```

4.NDP Proxy Logs
```
2025-11-30T20:24:56	Notice	ndpproxy	 skipping upstream forward on P2P interface pppoe0 (type 136)
2025-11-30T20:24:56	Notice	ndpproxy	 forwarding NA from vlan03 (target fe80::6a84:7eff:fea1:e828) to upstream
2025-11-30T20:24:28	Notice	ndpproxy	 skipping upstream forward on P2P interface pppoe0 (type 136)
2025-11-30T20:24:28	Notice	ndpproxy	 forwarding NA from vlan03 (target fe80::6a84:7eff:fea1:e828) to upstream
2025-11-30T20:23:20	Notice	ndpproxy	 skipping upstream forward on P2P interface pppoe0 (type 136)
2025-11-30T20:23:20	Notice	ndpproxy	 forwarding NA from vlan03 (target fe80::6a84:7eff:fea1:e828) to upstream
2025-11-30T20:22:12	Notice	ndpproxy	 skipping upstream forward on P2P interface pppoe0 (type 136)
2025-11-30T20:22:12	Notice	ndpproxy	 forwarding NA from vlan03 (target fe80::6a84:7eff:fea1:e828) to upstream
2025-11-30T20:21:11	Notice	ndpproxy	 skipping upstream forward on P2P interface pppoe0 (type 136)
2025-11-30T20:21:11	Notice	ndpproxy	 forwarding NA from vlan03 (target fe80::6a84:7eff:fea1:e828) to upstream
2025-11-30T20:20:26	Notice	ndpproxy	 skipping upstream forward on P2P interface pppoe0 (type 136)
2025-11-30T20:20:26	Notice	ndpproxy	 forwarding NA from vlan03 (target fe80::6a84:7eff:fea1:e828) to upstream
2025-11-30T20:19:41	Notice	ndpproxy	 skipping upstream forward on P2P interface pppoe0 (type 136)
2025-11-30T20:19:41	Notice	ndpproxy	 forwarding NA from vlan03 (target fe80::6a84:7eff:fea1:e828) to upstream
2025-11-30T20:18:53	Notice	ndpproxy	 skipping upstream forward on P2P interface pppoe0 (type 136)
2025-11-30T20:18:53	Notice	ndpproxy	 forwarding NA from vlan03 (target fe80::6a84:7eff:fea1:e828) to upstream
2025-11-30T20:18:09	Notice	ndpproxy	 skipping upstream forward on P2P interface pppoe0 (type 136)
2025-11-30T20:18:09	Notice	ndpproxy	 forwarding NA from vlan03 (target fe80::6a84:7eff:fea1:e828) to upstream
2025-11-30T20:17:40	Notice	ndpproxy	 skipping upstream forward on P2P interface pppoe0 (type 136)
2025-11-30T20:17:40	Notice	ndpproxy	 forwarding NA from vlan03 (target fe80::6a84:7eff:fea1:e828) to upstream
2025-11-30T20:17:12	Notice	ndpproxy	 skipping upstream forward on P2P interface pppoe0 (type 136)
2025-11-30T20:17:12	Notice	ndpproxy	 forwarding NA from vlan03 (target fe80::6a84:7eff:fea1:e828) to upstream
2025-11-30T20:16:43	Notice	ndpproxy	 skipping upstream forward on P2P interface pppoe0 (type 136)
2025-11-30T20:16:43	Notice	ndpproxy	 forwarding NA from vlan03 (target fe80::6a84:7eff:fea1:e828) to upstream
2025-11-30T20:16:41	Notice	ndpproxy	 RA prefix learned: 2001:b011:abcd:dfgh::/64 (valid 24h0m0s)
2025-11-30T20:16:41	Notice	ndpproxy	 router LLA learned: fe80::9ee0:41ff:febc:2098
2025-11-30T20:16:14	Notice	ndpproxy	 skipping upstream forward on P2P interface pppoe0 (type 136)
2025-11-30T20:16:14	Notice	ndpproxy	 forwarding NA from vlan03 (target fe80::6a84:7eff:fea1:e828) to upstream
2025-11-30T20:15:46	Notice	ndpproxy	 skipping upstream forward on P2P interface pppoe0 (type 136)
2025-11-30T20:15:46	Notice	ndpproxy	 forwarding NA from vlan03 (target fe80::6a84:7eff:fea1:e828) to upstream
2025-11-30T20:15:17	Notice	ndpproxy	 skipping upstream forward on P2P interface pppoe0 (type 136)
2025-11-30T20:15:17	Notice	ndpproxy	 forwarding NA from vlan03 (target fe80::6a84:7eff:fea1:e828) to upstream
2025-11-30T20:14:48	Notice	ndpproxy	 skipping upstream forward on P2P interface pppoe0 (type 136)
2025-11-30T20:14:48	Notice	ndpproxy	 forwarding NA from vlan03 (target fe80::6a84:7eff:fea1:e828) to upstream
2025-11-30T20:14:19	Notice	ndpproxy	 skipping upstream forward on P2P interface pppoe0 (type 136)
2025-11-30T20:14:19	Notice	ndpproxy	 forwarding NA from vlan03 (target fe80::6a84:7eff:fea1:e828) to upstream
2025-11-30T20:13:47	Notice	ndpproxy	 skipping upstream forward on P2P interface pppoe0 (type 136)
2025-11-30T20:13:47	Notice	ndpproxy	 forwarding NA from vlan03 (target fe80::6a84:7eff:fea1:e828) to upstream
2025-11-30T20:13:11	Notice	ndpproxy	 skipping upstream forward on P2P interface pppoe0 (type 136)
2025-11-30T20:13:11	Notice	ndpproxy	 forwarding NA from vlan03 (target fe80::6a84:7eff:fea1:e828) to upstream
2025-11-30T20:12:04	Notice	ndpproxy	 skipping upstream forward on P2P interface pppoe0 (type 136)
2025-11-30T20:12:04	Notice	ndpproxy	 forwarding NA from vlan03 (target fe80::6a84:7eff:fea1:e828) to upstream
2025-11-30T20:11:52	Notice	ndpproxy	 route deleted: 2001:b011:abcd:dfgh:6a84:7eff:fea1:e828
2025-11-30T20:11:32	Notice	ndpproxy	 skipping upstream forward on P2P interface pppoe0 (type 136)
2025-11-30T20:11:32	Notice	ndpproxy	 forwarding NA from vlan03 (target fe80::6a84:7eff:fea1:e828) to upstream
2025-11-30T20:10:56	Notice	ndpproxy	 skipping upstream forward on P2P interface pppoe0 (type 136)
2025-11-30T20:10:56	Notice	ndpproxy	 forwarding NA from vlan03 (target fe80::6a84:7eff:fea1:e828) to upstream
2025-11-30T20:10:17	Notice	ndpproxy	 skipping upstream forward on P2P interface pppoe0 (type 136)
2025-11-30T20:10:17	Notice	ndpproxy	 forwarding NA from vlan03 (target fe80::6a84:7eff:fea1:e828) to upstream
2025-11-30T20:09:49	Notice	ndpproxy	 skipping upstream forward on P2P interface pppoe0 (type 136)
2025-11-30T20:09:49	Notice	ndpproxy	 forwarding NA from vlan03 (target fe80::6a84:7eff:fea1:e828) to upstream
2025-11-30T20:09:17	Notice	ndpproxy	 skipping upstream forward on P2P interface pppoe0 (type 136)
2025-11-30T20:09:17	Notice	ndpproxy	 forwarding NA from vlan03 (target fe80::6a84:7eff:fea1:e828) to upstream
2025-11-30T20:08:41	Notice	ndpproxy	 skipping upstream forward on P2P interface pppoe0 (type 136)
2025-11-30T20:08:41	Notice	ndpproxy	 forwarding NA from vlan03 (target fe80::6a84:7eff:fea1:e828) to upstream
2025-11-30T20:07:34	Notice	ndpproxy	 skipping upstream forward on P2P interface pppoe0 (type 136)
2025-11-30T20:07:34	Notice	ndpproxy	 forwarding NA from vlan03 (target fe80::6a84:7eff:fea1:e828) to upstream
2025-11-30T20:07:01	Notice	ndpproxy	 skipping upstream forward on P2P interface pppoe0 (type 136)
2025-11-30T20:07:01	Notice	ndpproxy	 forwarding NA from vlan03 (target fe80::6a84:7eff:fea1:e828) to upstream
2025-11-30T20:06:26	Notice	ndpproxy	 skipping upstream forward on P2P interface pppoe0 (type 136)
2025-11-30T20:06:26	Notice	ndpproxy	 forwarding NA from vlan03 (target fe80::6a84:7eff:fea1:e828) to upstream
2025-11-30T20:05:18	Notice	ndpproxy	 skipping upstream forward on P2P interface pppoe0 (type 136)
2025-11-30T20:05:18	Notice	ndpproxy	 forwarding NA from vlan03 (target fe80::6a84:7eff:fea1:e828) to upstream
2025-11-30T20:04:46	Notice	ndpproxy	 skipping upstream forward on P2P interface pppoe0 (type 136)
2025-11-30T20:04:46	Notice	ndpproxy	 forwarding NA from vlan03 (target fe80::6a84:7eff:fea1:e828) to upstream
2025-11-30T20:04:10	Notice	ndpproxy	 skipping upstream forward on P2P interface pppoe0 (type 136)
2025-11-30T20:04:10	Notice	ndpproxy	 forwarding NA from vlan03 (target fe80::6a84:7eff:fea1:e828) to upstream
2025-11-30T20:03:03	Notice	ndpproxy	 skipping upstream forward on P2P interface pppoe0 (type 136)
2025-11-30T20:03:03	Notice	ndpproxy	 forwarding NA from vlan03 (target fe80::6a84:7eff:fea1:e828) to upstream
2025-11-30T20:02:16	Notice	ndpproxy	 skipping upstream forward on P2P interface pppoe0 (type 136)
2025-11-30T20:02:16	Notice	ndpproxy	 forwarding NA from vlan03 (target fe80::6a84:7eff:fea1:e828) to upstream
2025-11-30T20:01:55	Notice	ndpproxy	 skipping upstream forward on P2P interface pppoe0 (type 135)
2025-11-30T20:01:54	Notice	ndpproxy	 skipping upstream forward on P2P interface pppoe0 (type 135)
2025-11-30T20:01:53	Notice	ndpproxy	 skipping upstream forward on P2P interface pppoe0 (type 135)
2025-11-30T20:01:48	Notice	ndpproxy	 skipping upstream forward on P2P interface pppoe0 (type 136)
2025-11-30T20:01:48	Notice	ndpproxy	 forwarding NA from vlan03 (target 2001:b011:abcd:dfgh:6a84:7eff:fea1:e828) to upstream
2025-11-30T20:01:48	Notice	ndpproxy	 learned address 2001:b011:abcd:dfgh:6a84:7eff:fea1:e828 from NA on vlan03 (port 0)
2025-11-30T20:01:48	Notice	ndpproxy	 cache entry TTL refreshed 2001:b011:abcd:dfgh:6a84:7eff:fea1:e828 on vlan03 (port 0)
2025-11-30T20:01:48	Notice	ndpproxy	 cache entry TTL refreshed 2001:b011:abcd:dfgh:6a84:7eff:fea1:e828 on vlan03 (port 0)
2025-11-30T20:01:43	Notice	ndpproxy	 skipping upstream forward on P2P interface pppoe0 (type 135)
2025-11-30T20:01:43	Notice	ndpproxy	 cache entry TTL refreshed 2001:b011:abcd:dfgh:6a84:7eff:fea1:e828 on vlan03 (port 0)
2025-11-30T20:01:42	Notice	ndpproxy	 route installed: 2001:b011:abcd:dfgh:6a84:7eff:fea1:e828 via vlan03
2025-11-30T20:01:42	Notice	ndpproxy	 skipping upstream forward on P2P interface pppoe0 (type 135)
2025-11-30T20:01:42	Notice	ndpproxy	 learned 2001:b011:abcd:dfgh:6a84:7eff:fea1:e828 on vlan03 (port 0)
2025-11-30T20:01:38	Notice	ndpproxy	 RA prefix learned: 2001:b011:abcd:dfgh::/64 (valid 24h0m0s)
2025-11-30T20:01:38	Notice	ndpproxy	 router LLA learned: fe80::9ee0:41ff:febc:2098
2025-11-30T20:01:37	Notice	ndpproxy	 forwarding RS on P2P interface pppoe0 to trigger RA
2025-11-30T20:00:11	Notice	ndpproxy	 skipping upstream forward on P2P interface pppoe0 (type 136)
2025-11-30T20:00:11	Notice	ndpproxy	 forwarding NA from vlan03 (target fe80::6a84:7eff:fea1:e828) to upstream
-> testing machine reboot between 20:00 ~ 20:01

2025-11-30T19:59:17	Notice	ndpproxy	 skipping upstream forward on P2P interface pppoe0 (type 136)
2025-11-30T19:59:17	Notice	ndpproxy	 forwarding NA from vlan03 (target fe80::6a84:7eff:fea1:e828) to upstream
2025-11-30T19:58:45	Notice	ndpproxy	 skipping upstream forward on P2P interface pppoe0 (type 136)
2025-11-30T19:58:45	Notice	ndpproxy	 forwarding NA from vlan03 (target fe80::6a84:7eff:fea1:e828) to upstream
2025-11-30T19:58:09	Notice	ndpproxy	 skipping upstream forward on P2P interface pppoe0 (type 136)
2025-11-30T19:58:09	Notice	ndpproxy	 forwarding NA from vlan03 (target fe80::6a84:7eff:fea1:e828) to upstream
2025-11-30T19:57:02	Notice	ndpproxy	 skipping upstream forward on P2P interface pppoe0 (type 136)
2025-11-30T19:57:02	Notice	ndpproxy	 forwarding NA from vlan03 (target fe80::6a84:7eff:fea1:e828) to upstream
2025-11-30T19:56:30	Notice	ndpproxy	 skipping upstream forward on P2P interface pppoe0 (type 136)
2025-11-30T19:56:30	Notice	ndpproxy	 forwarding NA from vlan03 (target fe80::6a84:7eff:fea1:e828) to upstream
2025-11-30T19:55:54	Notice	ndpproxy	 skipping upstream forward on P2P interface pppoe0 (type 136)
2025-11-30T19:55:54	Notice	ndpproxy	 forwarding NA from vlan03 (target fe80::6a84:7eff:fea1:e828) to upstream
2025-11-30T19:54:48	Notice	ndpproxy	 skipping upstream forward on P2P interface pppoe0 (type 136)
2025-11-30T19:54:48	Notice	ndpproxy	 forwarding NA from vlan03 (target fe80::6a84:7eff:fea1:e828) to upstream
2025-11-30T19:54:15	Notice	ndpproxy	 skipping upstream forward on P2P interface pppoe0 (type 136)
2025-11-30T19:54:15	Notice	ndpproxy	 forwarding NA from vlan03 (target fe80::6a84:7eff:fea1:e828) to upstream
2025-11-30T19:53:56	Notice	ndpproxy	 RA prefix learned: 2001:b011:abcd:dfgh::/64 (valid 24h0m0s)
2025-11-30T19:53:56	Notice	ndpproxy	 router LLA learned: fe80::9ee0:41ff:febc:2098
2025-11-30T19:53:39	Notice	ndpproxy	 skipping upstream forward on P2P interface pppoe0 (type 136)
2025-11-30T19:53:39	Notice	ndpproxy	 forwarding NA from vlan03 (target fe80::6a84:7eff:fea1:e828) to upstream
2025-11-30T19:52:32	Notice	ndpproxy	 skipping upstream forward on P2P interface pppoe0 (type 136)
2025-11-30T19:52:32	Notice	ndpproxy	 forwarding NA from vlan03 (target fe80::6a84:7eff:fea1:e828) to upstream
2025-11-30T19:52:00	Notice	ndpproxy	 skipping upstream forward on P2P interface pppoe0 (type 136)
2025-11-30T19:52:00	Notice	ndpproxy	 forwarding NA from vlan03 (target fe80::6a84:7eff:fea1:e828) to upstream
2025-11-30T19:51:24	Notice	ndpproxy	 skipping upstream forward on P2P interface pppoe0 (type 136)
2025-11-30T19:51:24	Notice	ndpproxy	 forwarding NA from vlan03 (target fe80::6a84:7eff:fea1:e828) to upstream
2025-11-30T19:50:17	Notice	ndpproxy	 skipping upstream forward on P2P interface pppoe0 (type 136)
2025-11-30T19:50:17	Notice	ndpproxy	 forwarding NA from vlan03 (target fe80::6a84:7eff:fea1:e828) to upstream
2025-11-30T19:49:09	Notice	ndpproxy	 skipping upstream forward on P2P interface pppoe0 (type 136)
2025-11-30T19:49:09	Notice	ndpproxy	 forwarding NA from vlan03 (target fe80::6a84:7eff:fea1:e828) to upstream
2025-11-30T19:48:02	Notice	ndpproxy	 skipping upstream forward on P2P interface pppoe0 (type 136)
2025-11-30T19:48:02	Notice	ndpproxy	 forwarding NA from vlan03 (target fe80::6a84:7eff:fea1:e828) to upstream
2025-11-30T19:46:53	Notice	ndpproxy	 skipping upstream forward on P2P interface pppoe0 (type 136)
2025-11-30T19:46:53	Notice	ndpproxy	 forwarding NA from vlan03 (target fe80::6a84:7eff:fea1:e828) to upstream
2025-11-30T19:45:46	Notice	ndpproxy	 skipping upstream forward on P2P interface pppoe0 (type 136)
2025-11-30T19:45:46	Notice	ndpproxy	 forwarding NA from vlan03 (target fe80::6a84:7eff:fea1:e828) to upstream
2025-11-30T19:44:38	Notice	ndpproxy	 skipping upstream forward on P2P interface pppoe0 (type 136)
2025-11-30T19:44:38	Notice	ndpproxy	 forwarding NA from vlan03 (target fe80::6a84:7eff:fea1:e828) to upstream
2025-11-30T19:43:31	Notice	ndpproxy	 skipping upstream forward on P2P interface pppoe0 (type 136)
2025-11-30T19:43:31	Notice	ndpproxy	 forwarding NA from vlan03 (target fe80::6a84:7eff:fea1:e828) to upstream
2025-11-30T19:42:22	Notice	ndpproxy	 skipping upstream forward on P2P interface pppoe0 (type 136)
2025-11-30T19:42:22	Notice	ndpproxy	 forwarding NA from vlan03 (target fe80::6a84:7eff:fea1:e828) to upstream
2025-11-30T19:41:28	Notice	ndpproxy	 skipping upstream forward on P2P interface pppoe0 (type 136)
2025-11-30T19:41:28	Notice	ndpproxy	 forwarding NA from vlan03 (target fe80::dea6:32ff:febf:802b) to upstream
2025-11-30T19:41:15	Notice	ndpproxy	 skipping upstream forward on P2P interface pppoe0 (type 136)
2025-11-30T19:41:15	Notice	ndpproxy	 forwarding NA from vlan03 (target fe80::6a84:7eff:fea1:e828) to upstream
2025-11-30T19:40:52	Notice	ndpproxy	 skipping upstream forward on P2P interface pppoe0 (type 136)
2025-11-30T19:40:52	Notice	ndpproxy	 forwarding NA from vlan03 (target fe80::dea6:32ff:febf:802b) to upstream
2025-11-30T19:40:07	Notice	ndpproxy	 skipping upstream forward on P2P interface pppoe0 (type 136)
2025-11-30T19:40:07	Notice	ndpproxy	 forwarding NA from vlan03 (target fe80::6a84:7eff:fea1:e828) to upstream
2025-11-30T19:40:02	Notice	ndpproxy	 skipping upstream forward on P2P interface pppoe0 (type 136)
2025-11-30T19:40:02	Notice	ndpproxy	 forwarding NA from vlan03 (target fe80::dea6:32ff:febf:802b) to upstream
2025-11-30T19:39:27	Notice	ndpproxy	 skipping upstream forward on P2P interface pppoe0 (type 136)
2025-11-30T19:39:27	Notice	ndpproxy	 forwarding NA from vlan03 (target fe80::dea6:32ff:febf:802b) to upstream
2025-11-30T19:39:00	Notice	ndpproxy	 skipping upstream forward on P2P interface pppoe0 (type 136)
2025-11-30T19:39:00	Notice	ndpproxy	 forwarding NA from vlan03 (target fe80::6a84:7eff:fea1:e828) to upstream
2025-11-30T19:38:53	Notice	ndpproxy	 RA prefix learned: 2001:b011:abcd:dfgh::/64 (valid 24h0m0s)
2025-11-30T19:38:53	Notice	ndpproxy	 router LLA learned: fe80::9ee0:41ff:febc:2098
2025-11-30T19:38:52	Notice	ndpproxy	 sending Router Solicitation on pppoe0
2025-11-30T19:38:52	Notice	ndpproxy	 upstream=pppoe0 downstream=vlan03 no-ra=false no-routes=false no-dad=false no-rewrite-lla=false cache-ttl=10m0s cache-max=4096 route-qps=50 route-burst=50 pcap-timeout=50ms
```

**Comment by leo15dev** [comment]
After using the latest experimental version of `ndp-proxy-go` and modifying the firewall rules as you mentioned above, the issue is resolved!

I believe this issue can now be closed. Thanks for your help!
